<?xml version="1.0" encoding="UTF-8"?>
<actionDescriptions 
  xmlns="http://www.iese.fhg.de/esf/1.0/action"
  xmlns:tns="http://www.iese.fhg.de/esf/1.0/action"
  xmlns:a="http://www.iese.fhg.de/esf/1.0/action" 
  xmlns:xsi="http://www.w3.org/2001/XMLSchema-instance"
  xsi:noNamespaceSchemaLocation="action-FhG.xsd"  
  xsi:schemaLocation="http://www.iese.fhg.de/esf/1.0/action action-FhG.xsd">
  
  <actionDescription name="syscall" class="OTHER">
    <parameterDescription name="processId"/>
    <parameterDescription name="command"/>
    <parameterDescription name="username">
      <value>neisse</value>
      <value>moucha</value>
      <value>pretschner</value>
    </parameterDescription>
  </actionDescription>
  
  <actionDescription name="open" class="USAGE" subclassOf="syscall">
    <parameterDescription name="pathname"/>
  </actionDescription>
  
</actionDescriptions>